name,profile_url,role,email,recent_publications_json,openalex_author_id,openalex_orcid,openalex_confidence,openalex_notes,openalex_candidates_json
Andrea Aparicio Castro,https://www.demography.ox.ac.uk/people/andrea-aparicio-castro,Senior Research Fellow in Bayesian Digital Demography,andrea.apariciocastro@demography.ox.ac.uk,"[{""title"": ""Estimating and Conditional Forecasting Bilateral Migration Flows Between South America and Europe, 1985–2050"", ""url"": ""https://www.doi.org/10.1177/01979183251352404"", ""type"": null, ""citation"": ""Aparicio Castro, A. et al. (2025) “ Estimating and Conditional Forecasting Bilateral Migration Flows Between South America and Europe, 1985–2050 ”, International Migration Review [Preprint]."", ""year"": 2025}, {""title"": ""A Bayesian approach to estimate annual bilateral migration flows for South America using census data"", ""url"": ""https://www.doi.org/10.1093/jrsssa/qnad127"", ""type"": null, ""citation"": ""Aparicio Castro, A., Wiśniowski, A. and Rowe, F. (2024) “ A Bayesian approach to estimate annual bilateral migration flows for South America using census data ”, Journal of the Royal Statistical Society Series A: Statistics in Society , 187(2), pp. 410–435."", ""year"": 2024}, {""title"": ""The economic impact of the COVID-19 pandemic on ethnic minorities in Manchester: lessons from the early stage of the pandemic."", ""url"": ""https://www.doi.org/10.3389/fsoc.2023.1139258"", ""type"": null, ""citation"": ""Wiśniowski, A. et al. (2023) “ The economic impact of the COVID-19 pandemic on ethnic minorities in Manchester: lessons from the early stage of the pandemic. ”, Frontiers in sociology , 8, p. 1139258."", ""year"": 2023}, {""title"": ""Hospital length of stay for COVID-19 patients: Data-driven methods for forward planning"", ""url"": ""https://www.doi.org/10.1186/s12879-021-06371-6"", ""type"": null, ""citation"": ""Vekaria, B. et al. (2021) “ Hospital length of stay for COVID-19 patients: Data-driven methods for forward planning ”, BMC Infectious Diseases , 21(1), p. 700."", ""year"": 2021}, {""title"": ""Length of Stay in ICU of Covid-19 Patients in England, March - May 2020"", ""url"": ""https://www.doi.org/10.23889/ijpds.v5i4.1411"", ""type"": null, ""citation"": ""Shryane, N. et al. (2021) “ Length of Stay in ICU of Covid-19 Patients in England, March - May 2020 ”, International Journal for Population Data Science , 5(4), p. 1411."", ""year"": 2021}, {""title"": ""Hospital Length of Stay For COVID-19 Patients: Data-Driven Methods for Forward Planning"", ""url"": ""https://www.doi.org/10.21203/rs.3.rs-56855/v1"", ""type"": null, ""citation"": ""Vekaria, B. et al. (2020) “ Hospital Length of Stay For COVID-19 Patients: Data-Driven Methods for Forward Planning ”, Springer Science and Business Media LLC ."", ""year"": 2020}, {""title"": ""De cómo los lugares con contextos dominados por la desigualdad vuelven ineficaces las labores de las instituciones del Estado"", ""url"": ""https://www.doi.org/10.15446/rcs.v38n2.54885"", ""type"": null, ""citation"": ""Aparicio Castro, A. and Moreno Castro, J. (2015) “ De cómo los lugares con contextos dominados por la desigualdad vuelven ineficaces las labores de las instituciones del Estado ”, Revista Colombiana de Sociología , 38(2), pp. 39–65."", ""year"": 2015}, {""title"": ""The Economic Impact of the COVID-19 Pandemic on Ethnic Minorities in Manchester"", ""url"": ""https://www.doi.org/10.2139/ssrn.3949593"", ""type"": null, ""citation"": ""Allen, R. et al. (no date) “ The Economic Impact of the COVID-19 Pandemic on Ethnic Minorities in Manchester ”, SSRN Electronic Journal [Preprint]."", ""year"": null}]",https://openalex.org/A5009308391,https://orcid.org/0000-0001-6498-7025,LOW,"Fallback global search. Oxford-works=0, score=2.86","[{""id"": ""https://openalex.org/A5009308391"", ""display_name"": ""Andrea Aparicio-Castro"", ""works_count"": 18, ""oxford_works"": 0}]"
Daniel Valdenegro,https://www.demography.ox.ac.uk/people/daniel-valdenegro,Senior Data Scientist,daniel.valdenegro@demography.ox.ac.uk,[],https://openalex.org/A5117556638,,MEDIUM,"Oxford-filtered search. Oxford-works=1, score=3.20","[{""id"": ""https://openalex.org/A5117556638"", ""display_name"": ""Daniel Valdenegro"", ""works_count"": 1, ""oxford_works"": 1}, {""id"": ""https://openalex.org/A5038099881"", ""display_name"": ""Daniel Valdenegro Ibarra"", ""works_count"": 2, ""oxford_works"": 1}]"
Morten Kjær Thomsen,https://www.demography.ox.ac.uk/people/morten-kjaer-thomsen,Postdoctoral Research Fellow,morten.thomsen@sociology.ox.ac.uk,"[{""title"": ""Mortality Patterns in the Intersex Population"", ""url"": ""https://www.doi.org/10.31235/osf.io/bu92v_v1"", ""type"": null, ""citation"": ""Thomsen, M., Tilstra, A. and Greve, J. (2026) “ Mortality Patterns in the Intersex Population ”, SocArXiv ."", ""year"": 2026}, {""title"": ""Transgender lives at the population level: evidence from Danish administrative data"", ""url"": ""https://www.doi.org/10.1016/j.socscimed.2024.117182"", ""type"": null, ""citation"": ""Thomsen, M., Andersen, M. and Greve, J. (2024) “ Transgender lives at the population level: evidence from Danish administrative data ”, Social Science and Medicine , 358."", ""year"": 2024}]",https://openalex.org/A5035652277,,MEDIUM,"Oxford-filtered search. Oxford-works=2, score=3.40","[{""id"": ""https://openalex.org/A5035652277"", ""display_name"": ""Morten Kjær Thomsen"", ""works_count"": 5, ""oxford_works"": 2}]"
Sander Wagner,https://www.demography.ox.ac.uk/people/sander-wagner,Research Associate,sander.wagner@demography.ox.ac.uk,[],https://openalex.org/A5013150502,https://orcid.org/0000-0002-1294-1612,MEDIUM,"Oxford-filtered search. Oxford-works=2, score=3.40","[{""id"": ""https://openalex.org/A5013150502"", ""display_name"": ""Sander Wagner"", ""works_count"": 11, ""oxford_works"": 2}]"
Kim Stienstra (PhD),https://www.demography.ox.ac.uk/people/kim-stienstra,NWO Rubicon Fellow 2025-27,l.k.stienstra@uu.nl,[],,,NONE,No OpenAlex author candidates.,
Ursula Gazeley,https://www.demography.ox.ac.uk/people/ursula-gazeley,Postdoctoral Researcher,,"[{""title"": ""Accounting for stillbirths in maternal health metrics: a cross-country analysis"", ""url"": ""https://www.doi.org/10.1016/j.eclinm.2025.103303"", ""type"": null, ""citation"": ""Gazeley, U. et al. (2025) “ Accounting for stillbirths in maternal health metrics: a cross-country analysis ”, EClinicalMedicine , 85, p. 103303."", ""year"": 2025}, {""title"": ""Evolution of Life Expectancy and Lifespan Variation in Sub-Saharan Africa"", ""url"": ""https://www.doi.org/10.1101/2025.05.20.25328051"", ""type"": null, ""citation"": ""Mejía-Guevara, I. et al. (2025) “ Evolution of Life Expectancy and Lifespan Variation in Sub-Saharan Africa ”, medRxiv ."", ""year"": 2025}, {""title"": ""Ambient air pollution and the sex ratio at birth: a systematic review and narrative synthesis"", ""url"": ""https://www.doi.org/10.1101/2025.10.21.25338487"", ""type"": null, ""citation"": ""Gazeley, U. et al. (2025) “ Ambient air pollution and the sex ratio at birth: a systematic review and narrative synthesis ”, medRxiv ."", ""year"": 2025}, {""title"": ""The lifetime risk of maternal near miss morbidity in Asia, Africa, the Middle East, and Latin America: a cross-country systematic analysis"", ""url"": ""https://www.doi.org/10.1016/s2214-109x(24)00322-x"", ""type"": null, ""citation"": ""Gazeley, U. et al. (2024) “ The lifetime risk of maternal near miss morbidity in Asia, Africa, the Middle East, and Latin America: a cross-country systematic analysis ”, Lancet Global Health , 12(11), pp. e1775 - e1784."", ""year"": 2024}, {""title"": ""mHealth interventions for postpartum family planning in LMICs: A realist review"", ""url"": ""https://www.doi.org/10.1371/journal.pgph.0003432"", ""type"": null, ""citation"": ""Chandrasekar, A. et al. (2024) “ mHealth interventions for postpartum family planning in LMICs: A realist review ”, PLOS Global Public Health , 4(7)."", ""year"": 2024}, {""title"": ""Postpartum recovery after severe maternal morbidity in Kilifi, Kenya: a grounded theory of recovery trajectories beyond 42 days"", ""url"": ""https://www.doi.org/10.1136/bmjgh-2023-014821"", ""type"": null, ""citation"": ""Gazeley, U. et al. (2024) “ Postpartum recovery after severe maternal morbidity in Kilifi, Kenya: a grounded theory of recovery trajectories beyond 42 days ”, BMJ Global Health , 9(6), p. e014821."", ""year"": 2024}, {""title"": ""Lifetime risk of maternal near miss morbidity: a novel indicator of maternal health"", ""url"": ""https://www.doi.org/10.1093/ije/dyad169"", ""type"": null, ""citation"": ""Gazeley, U. et al. (2024) “ Lifetime risk of maternal near miss morbidity: a novel indicator of maternal health ”, International Journal of Epidemiology , 53(1), p. dyad169."", ""year"": 2024}, {""title"": ""The Lifetime Risk of Maternal Near Miss morbidity in Asia, Africa, the Middle East, and Latin America: a cross-country systematic analysis"", ""url"": ""https://www.doi.org/10.1101/2024.03.26.24304883"", ""type"": null, ""citation"": ""Gazeley, U. et al. (2024) “ The Lifetime Risk of Maternal Near Miss morbidity in Asia, Africa, the Middle East, and Latin America: a cross-country systematic analysis ”, medRxiv ."", ""year"": 2024}, {""title"": ""Pregnancy‐related mortality up to 1 year postpartum in sub‐Saharan Africa: an analysis of verbal autopsy data from six countries"", ""url"": ""https://www.doi.org/10.1111/1471-0528.17606"", ""type"": null, ""citation"": ""Gazeley, U. et al. (2024) “ Pregnancy‐related mortality up to 1 year postpartum in sub‐Saharan Africa: an analysis of verbal autopsy data from six countries ”, BJOG An International Journal of Obstetrics & Gynaecology , 131(2), pp. 163–174."", ""year"": 2024}, {""title"": ""Burden and causes of pregnancy-related mortality in The Gambia: evidence from census and health and demographic surveillance data"", ""url"": ""https://www.doi.org/10.1136/bmjph-2023-000019"", ""type"": null, ""citation"": ""Jasseh, M. et al. (2023) “ Burden and causes of pregnancy-related mortality in The Gambia: evidence from census and health and demographic surveillance data ”, BMJ Public Health , 1(1), p. e000019."", ""year"": 2023}]",https://openalex.org/A5036734767,https://orcid.org/0000-0003-3309-7411,HIGH,"Oxford-filtered search. Oxford-works=13, score=5.60","[{""id"": ""https://openalex.org/A5036734767"", ""display_name"": ""Ursula Gazeley"", ""works_count"": 24, ""oxford_works"": 13}]"
Aasli Abdi Nur,https://www.demography.ox.ac.uk/people/aasli-abdi-nur,Postdoctoral Research Fellow,aasli.nur@sociology.ox.ac.uk,"[{""title"": ""Fifty years of Population and Development Review: shifting research themes, authorship, and academic impact in comparative perspective"", ""url"": ""https://www.doi.org/10.1111/padr.70001"", ""type"": null, ""citation"": ""Kashyap, R. and Nur, A. (2025) “ Fifty years of Population and Development Review: shifting research themes, authorship, and academic impact in comparative perspective ”, Population and Development Review , 51(1), pp. 17–39."", ""year"": 2025}, {""title"": ""Who actualizes postpartum contraceptive intentions? A trajectory cluster analysis"", ""url"": ""https://www.doi.org/10.1186/s12978-024-01899-7"", ""type"": null, ""citation"": ""O’Brien, M. and Nur, A. (2024) “ Who actualizes postpartum contraceptive intentions? A trajectory cluster analysis ”, Reproductive Health , 21(1)."", ""year"": 2024}, {""title"": ""Managing and minimizing online survey questionnaire fraud: lessons from the Triple C project"", ""url"": ""https://www.doi.org/10.1080/13645579.2023.2229651"", ""type"": null, ""citation"": ""Nur, A. et al. (2024) “ Managing and minimizing online survey questionnaire fraud: lessons from the Triple C project ”, International Journal of Social Research Methodology , 27(5), pp. 613–619."", ""year"": 2024}, {""title"": ""Drivers of COVID-19 policy stringency in 175 countries and territories: COVID-19 cases and deaths, gross domestic products per capita, and health expenditures"", ""url"": ""https://www.doi.org/10.7189/jogh.12.05049"", ""type"": null, ""citation"": ""Jalloh, M. et al. (2022) “ Drivers of COVID-19 policy stringency in 175 countries and territories: COVID-19 cases and deaths, gross domestic products per capita, and health expenditures ”, Journal of Global Health , 12, p. 05049."", ""year"": 2022}, {""title"": ""Behaviour adoption approaches during public health emergencies: implications for the COVID-19 pandemic and beyond"", ""url"": ""https://www.doi.org/10.1136/bmjgh-2020-004450"", ""type"": null, ""citation"": ""Jalloh, M. et al. (2021) “ Behaviour adoption approaches during public health emergencies: implications for the COVID-19 pandemic and beyond ”, BMJ Global Health , 6(1), p. e004450."", ""year"": 2021}, {""title"": ""Human and economic resources for empowerment and pregnancy-related mental health in the Arab Middle East: a systematic review"", ""url"": ""https://www.doi.org/10.1007/s00737-018-0843-0"", ""type"": null, ""citation"": ""James-Hawkins, L. et al. (2019) “ Human and economic resources for empowerment and pregnancy-related mental health in the Arab Middle East: a systematic review ”, Archives of Women’s Mental Health , 22(1), pp. 1–14."", ""year"": 2019}, {""title"": ""Social resources and Arab women’s perinatal mental health: A systematic review"", ""url"": ""https://www.doi.org/10.1016/j.wombi.2017.11.005"", ""type"": null, ""citation"": ""Qutteina, Y. et al. (2018) “ Social resources and Arab women’s perinatal mental health: A systematic review ”, Women and Birth , 31(5), pp. 386–397."", ""year"": 2018}]",https://openalex.org/A5114732139,,MEDIUM,"Oxford-filtered search. Oxford-works=2, score=3.40","[{""id"": ""https://openalex.org/A5114732139"", ""display_name"": ""Aasli Abdi Nur"", ""works_count"": 2, ""oxford_works"": 2}]"
Stefania Benonisdottir,https://www.demography.ox.ac.uk/people/stefania-benonisdottir,Postdoctoral Researcher,stefania.benonisdottir@demography.ox.ac.uk,"[{""title"": ""Realizing the full potential of Our Future Health through data linkage and trans-biobank efforts"", ""url"": ""https://www.doi.org/10.1038/s41588-025-02327-7"", ""type"": null, ""citation"": ""Straub, V. et al. (2025) “ Realizing the full potential of Our Future Health through data linkage and trans-biobank efforts ”, Nature Genetics , 57(10), pp. 2341–2348."", ""year"": 2025}, {""title"": ""Genetics of female and male reproductive traits and their relationship with health, longevity and consequences for offspring"", ""url"": ""https://www.doi.org/10.1038/s43587-024-00733-w"", ""type"": null, ""citation"": ""Benonisdottir, S. et al. (2024) “ Genetics of female and male reproductive traits and their relationship with health, longevity and consequences for offspring ”, Nature Aging , 4(12), pp. 1745–1759."", ""year"": 2024}, {""title"": ""Studying the genetics of participation using footprints left on the ascertained genotypes"", ""url"": ""https://www.doi.org/10.1038/s41588-023-01439-2"", ""type"": null, ""citation"": ""Benonisdottir, S. and Kong, A. (2023) “ Studying the genetics of participation using footprints left on the ascertained genotypes ”, Nature Genetics , 55(8), pp. 1413–1420."", ""year"": 2023}, {""title"": ""Genetic insight into sick sinus syndrome."", ""url"": ""https://www.doi.org/10.1093/eurheartj/ehaa1108"", ""type"": null, ""citation"": ""Thorolfsdottir, R. et al. (2021) “ Genetic insight into sick sinus syndrome. ”, European heart journal , 42(20), pp. 1959–1971."", ""year"": 2021}, {""title"": ""Deconstructing the sources of genotype-phenotype associations in humans"", ""url"": ""https://www.doi.org/10.1126/science.aax3710"", ""type"": null, ""citation"": ""Young, A. et al. (2019) “ Deconstructing the sources of genotype-phenotype associations in humans ”, Science , 365(6460), pp. 1396–1400."", ""year"": 2019}, {""title"": ""The nature of nurture: Effects of parental genotypes"", ""url"": ""https://www.doi.org/10.1126/science.aan6877"", ""type"": null, ""citation"": ""Kong, A. et al. (2018) “ The nature of nurture: Effects of parental genotypes ”, Science , 359(6374), pp. 424–428."", ""year"": 2018}]",https://openalex.org/A5085673380,https://orcid.org/0000-0001-5019-514X,HIGH,"Oxford-filtered search. Oxford-works=20, score=5.59","[{""id"": ""https://openalex.org/A5085673380"", ""display_name"": ""Stefania Benónísdóttir"", ""works_count"": 50, ""oxford_works"": 20}]"
Juliana de Castro Galvao,https://www.demography.ox.ac.uk/people/juliana-de-castro-galvao,Associate Researcher,juliana.decastrogalvao@nuffield.ox.ac.uk,[],https://openalex.org/A5003127205,https://orcid.org/0000-0003-3698-3881,LOW,"Fallback global search. Oxford-works=0, score=3.00","[{""id"": ""https://openalex.org/A5003127205"", ""display_name"": ""Juliana de Castro Galvao"", ""works_count"": 5, ""oxford_works"": 0}, {""id"": ""https://openalex.org/A5110457535"", ""display_name"": ""Juliana de Castro Galvão"", ""works_count"": 5, ""oxford_works"": 0}, {""id"": ""https://openalex.org/A5122545061"", ""display_name"": ""Juliana de Castro Galvão"", ""works_count"": 2, ""oxford_works"": 0}, {""id"": ""https://openalex.org/A5111211680"", ""display_name"": ""Juliana Galvao"", ""works_count"": 5, ""oxford_works"": 0}]"
Pablo Geraldo Bastías,https://www.demography.ox.ac.uk/people/pablo-geraldo-bastias,Associate Researcher,pablo.geraldo@nuffield.ox.ac.uk,[],https://openalex.org/A5017269096,,MEDIUM,"Oxford-filtered search. Oxford-works=1, score=3.20","[{""id"": ""https://openalex.org/A5017269096"", ""display_name"": ""Pablo Geraldo Bastías"", ""works_count"": 4, ""oxford_works"": 1}]"
Prashant Poddar,https://www.demography.ox.ac.uk/people/prashant-poddar,Postdoctoral Research Fellow,prashant.poddar@sociology.ox.ac.uk,[],https://openalex.org/A5043040277,,MEDIUM,"Fallback global search. Oxford-works=1, score=3.20","[{""id"": ""https://openalex.org/A5043040277"", ""display_name"": ""Prashant Poddar"", ""works_count"": 8, ""oxford_works"": 1}, {""id"": ""https://openalex.org/A5002092533"", ""display_name"": ""Prashant Poddar"", ""works_count"": 4, ""oxford_works"": 0}, {""id"": ""https://openalex.org/A5081186017"", ""display_name"": ""Nalin Prashant Poddar"", ""works_count"": 13, ""oxford_works"": 0}]"
Mary K. Roberts,https://www.demography.ox.ac.uk/people/mary-k-roberts,Postdoctoral Researcher,,"[{""title"": ""Factors influencing willingness to pursue living kidney donation among relatives of patients with kidney disease in the United States"", ""url"": ""https://www.doi.org/10.1186/s12882-026-04806-3"", ""type"": null, ""citation"": ""Roberts, M. et al. (2026) “ Factors influencing willingness to pursue living kidney donation among relatives of patients with kidney disease in the United States ”, BMC Nephrology [Preprint]."", ""year"": 2026}, {""title"": ""Kidney Replacement Therapy Sequences: Racial/Ethnic Disparities in End-Stage Kidney Disease Patients’ 10-Year Treatment Histories"", ""url"": ""https://www.doi.org/10.1016/j.xkme.2025.101175"", ""type"": null, ""citation"": ""Pessin, L. et al. (2025) “ Kidney Replacement Therapy Sequences: Racial/Ethnic Disparities in End-Stage Kidney Disease Patients’ 10-Year Treatment Histories ”, Kidney Medicine , pp. 101175–101175."", ""year"": 2025}, {""title"": ""Gender differences in willingness to be evaluated for living kidney donation"", ""url"": ""https://www.doi.org/10.1177/15269248251383950"", ""type"": null, ""citation"": ""Chumdermpadetsuk, R. et al. (2025) “ Gender differences in willingness to be evaluated for living kidney donation ”, Progress in Transplantation , 35(4), pp. 195–205."", ""year"": 2025}, {""title"": ""Why Would Kidney Disease Patients’ Family Members Be Willing to Donate a Kidney? Results from the Families of Renal Patients Survey"", ""url"": ""https://www.doi.org/10.1016/j.ajt.2025.07.1216"", ""type"": null, ""citation"": ""Daw, J. et al. (2025) “ Why Would Kidney Disease Patients’ Family Members Be Willing to Donate a Kidney? Results from the Families of Renal Patients Survey ”, American Journal of Transplantation , 25(8), p. s527."", ""year"": 2025}, {""title"": ""The long-term effects of housing insecurity in young adulthood on subsequent material hardship, physiological and mental health"", ""url"": ""https://www.doi.org/10.1016/j.socscimed.2025.117761"", ""type"": null, ""citation"": ""Roberts, M., Bhat, A. and Fenelon, A. (2025) “ The long-term effects of housing insecurity in young adulthood on subsequent material hardship, physiological and mental health ”, Social Science & Medicine , 367, pp. 117761–117761."", ""year"": 2025}, {""title"": ""The Importance of Describing Patient Populations"", ""url"": ""https://www.doi.org/10.1177/15269248241237823"", ""type"": null, ""citation"": ""Roberts, M. and Daw, J. (2024) “ The Importance of Describing Patient Populations ”, Progress in Transplantation , 34(1-2), pp. 58–59."", ""year"": 2024}, {""title"": ""Relationships, race/ethnicity, gender, age, and living kidney donation evaluation willingness"", ""url"": ""https://www.doi.org/10.1016/j.trim.2023.101980"", ""type"": null, ""citation"": ""Daw, J. et al. (2024) “ Relationships, race/ethnicity, gender, age, and living kidney donation evaluation willingness ”, Transplant Immunology , 83, p. 101980."", ""year"": 2024}, {""title"": ""The Determinants and Consequences of Living Donor Discussion Direction"", ""url"": ""https://www.doi.org/10.1177/15269248231212913"", ""type"": null, ""citation"": ""Roberts, M. and Daw, J. (2023) “ The Determinants and Consequences of Living Donor Discussion Direction ”, Progress in Transplantation , 33(4), pp. 310–317."", ""year"": 2023}, {""title"": ""Social network interventions to reduce race disparities in living kidney donation: Design and rationale of the friends and family of kidney transplant patients study (FFKTPS)"", ""url"": ""https://www.doi.org/10.1111/ctr.15064"", ""type"": null, ""citation"": ""Daw, J. et al. (2023) “ Social network interventions to reduce race disparities in living kidney donation: Design and rationale of the friends and family of kidney transplant patients study (FFKTPS) ”, Clinical Transplantation , 37(10), p. e15064."", ""year"": 2023}, {""title"": ""Testing the Differential Access Hypothesis That Black Kidney Transplant Candidates Perceive Social Network Access to Fewer Potential Living Donors Than White Candidates"", ""url"": ""https://www.doi.org/10.1177/15269248231164174"", ""type"": null, ""citation"": ""Daw, J. et al. (2023) “ Testing the Differential Access Hypothesis That Black Kidney Transplant Candidates Perceive Social Network Access to Fewer Potential Living Donors Than White Candidates ”, Progress in Transplantation , 33(2), pp. 130–140."", ""year"": 2023}]",https://openalex.org/A5101720611,https://orcid.org/0009-0008-1833-7441,MEDIUM,"Fallback global search. Oxford-works=3, score=3.27","[{""id"": ""https://openalex.org/A5101720611"", ""display_name"": ""Mary Roberts"", ""works_count"": 46, ""oxford_works"": 3}, {""id"": ""https://openalex.org/A5100975064"", ""display_name"": ""MARY K. ROBERTS"", ""works_count"": 1, ""oxford_works"": 0}, {""id"": ""https://openalex.org/A5046639748"", ""display_name"": ""Mary-Beth Roberts"", ""works_count"": 2, ""oxford_works"": 0}, {""id"": ""https://openalex.org/A5060572918"", ""display_name"": ""Mary K. Kimbrough"", ""works_count"": 58, ""oxford_works"": 0}, {""id"": ""https://openalex.org/A5051265860"", ""display_name"": ""Melissa Chan"", ""works_count"": 71, ""oxford_works"": 0}]"
Wen Su,https://www.demography.ox.ac.uk/people/wen-su,Postdoctoral Researcher,,[],https://openalex.org/A5101910394,https://orcid.org/0000-0001-9634-9474,LOW,"Fallback global search. Oxford-works=0, score=2.50","[{""id"": ""https://openalex.org/A5101910394"", ""display_name"": ""Wei Su"", ""works_count"": 173, ""oxford_works"": 0}, {""id"": ""https://openalex.org/A5100739301"", ""display_name"": ""Yu‐Wen Su"", ""works_count"": 95, ""oxford_works"": 0}, {""id"": ""https://openalex.org/A5068024272"", ""display_name"": ""Wei‐Wen Su"", ""works_count"": 143, ""oxford_works"": 0}, {""id"": ""https://openalex.org/A5057470021"", ""display_name"": ""Wen‐Hao Su"", ""works_count"": 133, ""oxford_works"": 0}, {""id"": ""https://openalex.org/A5018611627"", ""display_name"": ""Saou‐Wen Su"", ""works_count"": 166, ""oxford_works"": 0}, {""id"": ""https://openalex.org/A5010471217"", ""display_name"": ""Ming Su"", ""works_count"": 232, ""oxford_works"": 0}, {""id"": ""https://openalex.org/A5074710425"", ""display_name"": ""Min Wu"", ""works_count"": 1135, ""oxford_works"": 0}, {""id"": ""https://openalex.org/A5100352073"", ""display_name"": ""Xiaoyan Zhang"", ""works_count"": 853, ""oxford_works"": 0}]"
Daniel Zazueta-Borboa,https://www.demography.ox.ac.uk/people/daniel-zazueta-borboa,Postdoctoral Researcher,daniel.zazueta-borboa@demography.ox.ac.uk,[],https://openalex.org/A5013887530,https://orcid.org/0000-0003-4132-1057,HIGH,"Oxford-filtered search. Oxford-works=6, score=3.83","[{""id"": ""https://openalex.org/A5013887530"", ""display_name"": ""Jesús-Daniel Zazueta-Borboa"", ""works_count"": 18, ""oxford_works"": 6}]"
Emma Romell,https://www.demography.ox.ac.uk/people/emma-romell,Postdoctoral Researcher,emma.romell@demography.ox.ac.uk,[],https://openalex.org/A5017360849,https://orcid.org/0000-0002-0911-8019,LOW,"Fallback global search. Oxford-works=0, score=3.00","[{""id"": ""https://openalex.org/A5017360849"", ""display_name"": ""Emma Romell"", ""works_count"": 3, ""oxford_works"": 0}, {""id"": ""https://openalex.org/A5094137561"", ""display_name"": ""Emma Romell"", ""works_count"": 1, ""oxford_works"": 0}]"
