name,profile_url,role,email,recent_publications_json,openalex_author_id,openalex_orcid,openalex_confidence,openalex_notes,openalex_candidates_json
Melinda Mills,https://www.demography.ox.ac.uk/people/melinda-mills,"Director, Professor of Demography",melinda.mills@demography.ox.ac.uk,"[{""title"": ""Publisher Correction: Realizing the full potential of Our Future Health through data linkage and trans-biobank efforts"", ""url"": ""https://www.doi.org/10.1038/s41588-025-02452-3"", ""type"": null, ""citation"": ""Straub, V. et al. (2025) “ Publisher Correction: Realizing the full potential of Our Future Health through data linkage and trans-biobank efforts ”, Nature Genetics , pp. 1–1."", ""year"": 2025}, {""title"": ""Realizing the full potential of Our Future Health through data linkage and trans-biobank efforts"", ""url"": ""https://www.doi.org/10.1038/s41588-025-02327-7"", ""type"": null, ""citation"": ""Straub, V. et al. (2025) “ Realizing the full potential of Our Future Health through data linkage and trans-biobank efforts ”, Nature Genetics , 57(10), pp. 2341–2348."", ""year"": 2025}, {""title"": ""Night Shift Work and Sleep Duration among Middle and Older Age Adults: The Role of Individual, Social, and Environmental Moderators"", ""url"": ""https://www.doi.org/10.1016/j.socscimed.2025.118443"", ""type"": null, ""citation"": ""Ding, X. et al. (2025) “ Night Shift Work and Sleep Duration among Middle and Older Age Adults: The Role of Individual, Social, and Environmental Moderators ”, Social Science & Medicine , 384, p. 118443."", ""year"": 2025}, {""title"": ""Why they stay and why they go: The effect of role clarity and social relations on turnover and exclusion in Médecins sans Frontières Holland"", ""url"": ""https://www.doi.org/10.7765/9781526177964.00016"", ""type"": null, ""citation"": ""Heyse, L. et al. (2025) “ Why they stay and why they go: The effect of role clarity and social relations on turnover and exclusion in Médecins sans Frontières Holland ”, in Hierarchies and Exclusion in Humanitarianism , pp. 231–251."", ""year"": 2025}, {""title"": ""Socio-economic status is a social construct with heritable components and genetic consequences"", ""url"": ""https://www.doi.org/10.1038/s41562-025-02150-4"", ""type"": null, ""citation"": ""Abdellaoui, A. et al. (2025) “ Socio-economic status is a social construct with heritable components and genetic consequences ”, Nature Human Behaviour , 9(5), pp. 1–13."", ""year"": 2025}, {""title"": ""Author Correction: Genetics of female and male reproductive traits and their relationship with health, longevity and consequences for offspring."", ""url"": ""https://www.doi.org/10.1038/s43587-024-00800-2"", ""type"": null, ""citation"": ""Benonisdottir, S. et al. (2025) “ Author Correction: Genetics of female and male reproductive traits and their relationship with health, longevity and consequences for offspring. ”, Nature aging , pp. 1–1."", ""year"": 2025}, {""title"": ""Polygenic prediction of occupational status GWAS elucidates genetic and environmental interplay in intergenerational transmission, careers and health in UK Biobank"", ""url"": ""https://www.doi.org/10.1038/s41562-024-02076-3"", ""type"": null, ""citation"": ""Akimova, E. et al. (2024) “ Polygenic prediction of occupational status GWAS elucidates genetic and environmental interplay in intergenerational transmission, careers and health in UK Biobank ”, Nature Human Behaviour , 9(2), pp. 391–405."", ""year"": 2024}, {""title"": ""Genetics of female and male reproductive traits and their relationship with health, longevity and consequences for offspring"", ""url"": ""https://www.doi.org/10.1038/s43587-024-00733-w"", ""type"": null, ""citation"": ""Benonisdottir, S. et al. (2024) “ Genetics of female and male reproductive traits and their relationship with health, longevity and consequences for offspring ”, Nature Aging , 4(12), pp. 1745–1759."", ""year"": 2024}, {""title"": ""COVID-19 testing and reporting behaviours in England across different sociodemographic groups: a population-based study using testing data and data from community prevalence surveillance surveys"", ""url"": ""https://www.doi.org/10.1016/s2589-7500(24)00169-9"", ""type"": null, ""citation"": ""Bajaj, S. et al. (2024) “ COVID-19 testing and reporting behaviours in England across different sociodemographic groups: a population-based study using testing data and data from community prevalence surveillance surveys ”, The Lancet Digital Health , 6(11), pp. e778 - e790."", ""year"": 2024}, {""title"": ""The importance of family-based sampling for biobanks"", ""url"": ""https://www.doi.org/10.1038/s41586-024-07721-5"", ""type"": null, ""citation"": ""Davies, N. et al. (2024) “ The importance of family-based sampling for biobanks ”, Nature , 634(8035), pp. 795–803."", ""year"": 2024}]",https://openalex.org/A5018053342,https://orcid.org/0000-0003-1704-0001,HIGH,"Oxford-filtered search. Oxford-works=70, score=6.00","[{""id"": ""https://openalex.org/A5018053342"", ""display_name"": ""Melinda Mills"", ""works_count"": 265, ""oxford_works"": 70}, {""id"": ""https://openalex.org/A5082959833"", ""display_name"": ""Melinda Mills"", ""works_count"": 13, ""oxford_works"": 1}, {""id"": ""https://openalex.org/A5106477940"", ""display_name"": ""Melinda Mills"", ""works_count"": 1, ""oxford_works"": 0}]"
Jennifer Beam Dowd,https://www.demography.ox.ac.uk/people/jennifer-beam-dowd,"Deputy Director, Professor of Demography and Population Health",jennifer.dowd@demography.ox.ac.uk,"[{""title"": ""Temporary Shock or Lasting Scar? Life Expectancy Trajectories Since COVID-19"", ""url"": ""https://www.doi.org/10.64898/2026.02.25.26347112"", ""type"": null, ""citation"": ""Dowd, J. et al. (2026) “ Temporary Shock or Lasting Scar? Life Expectancy Trajectories Since COVID-19 ”, openRxiv ."", ""year"": 2026}, {""title"": ""Sex Differences in Excess Mortality During the COVID-19 Pandemic"", ""url"": ""https://www.doi.org/10.1101/2025.07.15.25331003"", ""type"": null, ""citation"": ""Doniec, K. et al. (2025) “ Sex Differences in Excess Mortality During the COVID-19 Pandemic ”, medRxiv ."", ""year"": 2025}, {""title"": ""Chronic health conditions and health-related economic inactivity in midlife: Evidence from the 1958 and 1970 British birth cohorts"", ""url"": ""https://www.doi.org/10.1101/2025.06.20.25329982"", ""type"": null, ""citation"": ""Gimeno, L. et al. (2025) “ Chronic health conditions and health-related economic inactivity in midlife: Evidence from the 1958 and 1970 British birth cohorts ”, medRxiv ."", ""year"": 2025}, {""title"": ""The Generational Health Drift: A Systematic Review of Evidence from the British Birth Cohort Studies"", ""url"": ""https://www.doi.org/10.1101/2025.06.12.25329414"", ""type"": null, ""citation"": ""Gimeno, L. et al. (2025) “ The Generational Health Drift: A Systematic Review of Evidence from the British Birth Cohort Studies ”, medRxiv ."", ""year"": 2025}, {""title"": ""Trends in alcohol-specific deaths in England, 2001–22: an observational study"", ""url"": ""https://www.doi.org/10.1016/s2468-2667(25)00047-7"", ""type"": null, ""citation"": ""Oldham, M. et al. (2025) “ Trends in alcohol-specific deaths in England, 2001–22: an observational study ”, The Lancet Public Health [Preprint]."", ""year"": 2025}, {""title"": ""Compositional analysis of lymphocytes and their relationship with health outcomes: findings from the health and retirement study"", ""url"": ""https://www.doi.org/10.1186/s12979-025-00505-z"", ""type"": null, ""citation"": ""Xu, L. et al. (2025) “ Compositional analysis of lymphocytes and their relationship with health outcomes: findings from the health and retirement study ”, Immunity & Ageing , 22(1)."", ""year"": 2025}, {""title"": ""Indirect effects of the COVID-19 pandemic: A cause-of-death analysis of life expectancy changes in 24 countries, 2015 to 2022"", ""url"": ""https://www.doi.org/10.1093/pnasnexus/pgae508"", ""type"": null, ""citation"": ""Polizzi, A. et al. (2024) “ Indirect effects of the COVID-19 pandemic: A cause-of-death analysis of life expectancy changes in 24 countries, 2015 to 2022 ”, PNAS Nexus , 4(1)."", ""year"": 2024}, {""title"": ""Progress Stalled? The Uncertain Future of Mortality in High‐Income Countries"", ""url"": ""https://www.doi.org/10.1111/padr.12687"", ""type"": null, ""citation"": ""Dowd, J., Polizzi, A. and Tilstra, A. (2024) “ Progress Stalled? The Uncertain Future of Mortality in High‐Income Countries ”, Population and Development Review [Preprint]."", ""year"": 2024}, {""title"": ""Midlife health in Britain and the United States: a comparison of two nationally representative cohorts"", ""url"": ""https://www.doi.org/10.1093/ije/dyae127"", ""type"": null, ""citation"": ""Staatz, C. et al. (2024) “ Midlife health in Britain and the United States: a comparison of two nationally representative cohorts ”, International Journal of Epidemiology , 53(5), p. dyae127."", ""year"": 2024}, {""title"": ""Cohort differences in physical health and disability in the United States and Europe"", ""url"": ""https://www.doi.org/10.1093/geronb/gbae113"", ""type"": null, ""citation"": ""Gimeno, L. et al. (2024) “ Cohort differences in physical health and disability in the United States and Europe ”, Journals of Gerontology, Series B: Psychological Sciences and Social Sciences , 79(8)."", ""year"": 2024}]",https://openalex.org/A5009798144,https://orcid.org/0000-0003-2006-5656,HIGH,"Fallback global search. Oxford-works=72, score=5.65","[{""id"": ""https://openalex.org/A5009798144"", ""display_name"": ""Jennifer B. Dowd"", ""works_count"": 179, ""oxford_works"": 72}]"
Jakub Bijak,https://www.demography.ox.ac.uk/people/jakub-bijak,Professor of Demographic Science,jakub.bijak@reuben.ox.ac.uk,[],https://openalex.org/A5063239904,https://orcid.org/0000-0002-2563-5040,MEDIUM,"Fallback global search. Oxford-works=3, score=3.60","[{""id"": ""https://openalex.org/A5063239904"", ""display_name"": ""Jakub Bijak"", ""works_count"": 191, ""oxford_works"": 3}, {""id"": ""https://openalex.org/A5004686562"", ""display_name"": ""Jakub Bijak"", ""works_count"": 3, ""oxford_works"": 0}]"
Ridhi Kashyap,https://www.demography.ox.ac.uk/people/ridhi-kashyap,Professor of Demography and Computational Social Science,ridhi.kashyap@demography.ox.ac.uk,"[{""title"": ""Temporary Shock or Lasting Scar? Life Expectancy Trajectories Since COVID-19"", ""url"": ""https://www.doi.org/10.64898/2026.02.25.26347112"", ""type"": null, ""citation"": ""Dowd, J. et al. (2026) “ Temporary Shock or Lasting Scar? Life Expectancy Trajectories Since COVID-19 ”, openRxiv ."", ""year"": 2026}, {""title"": ""Temperature and sex ratios at birth"", ""url"": ""https://www.doi.org/10.1073/pnas.2422625123"", ""type"": null, ""citation"": ""Ghany, J. et al. (2026) “ Temperature and sex ratios at birth ”, Proceedings of the National Academy of Sciences , 123(8)."", ""year"": 2026}, {""title"": ""Mapping subnational gender gaps in internet and mobile adoption using social media data"", ""url"": ""https://www.doi.org/10.1073/pnas.2416624122"", ""type"": null, ""citation"": ""Breen, C. et al. (2025) “ Mapping subnational gender gaps in internet and mobile adoption using social media data ”, Proceedings of the National Academy of Sciences , 122(42)."", ""year"": 2025}, {""title"": ""How Accurate Are High Resolution Settlement Maps at Predicting Population Counts in Data Scarce Settings?"", ""url"": ""https://www.doi.org/10.1002/psp.70083"", ""type"": null, ""citation"": ""Darin, E., Kashyap, R. and Leasure, D. (2025) “ How Accurate Are High Resolution Settlement Maps at Predicting Population Counts in Data Scarce Settings? ”, Population, Space and Place , 31(6)."", ""year"": 2025}, {""title"": ""Access to technology and foundational math proficiency among students: empirical evidence from India"", ""url"": ""https://www.doi.org/10.1057/s41599-025-05224-w"", ""type"": null, ""citation"": ""Poddar, P., Rotondi, V. and Kashyap, R. (2025) “ Access to technology and foundational math proficiency among students: empirical evidence from India ”, Humanities & Social Sciences Communications , 12(1)."", ""year"": 2025}, {""title"": ""Fifty years of Population and Development Review: shifting research themes, authorship, and academic impact in comparative perspective"", ""url"": ""https://www.doi.org/10.1111/padr.70001"", ""type"": null, ""citation"": ""Kashyap, R. and Nur, A. (2025) “ Fifty years of Population and Development Review: shifting research themes, authorship, and academic impact in comparative perspective ”, Population and Development Review , 51(1), pp. 17–39."", ""year"": 2025}, {""title"": ""Preface"", ""url"": ""https://www.doi.org/10.1111/padr.70006"", ""type"": null, ""citation"": ""Bongaarts, J., Kashyap, R. and Van Hook, J. (2025) “ Preface ”, Population and Development Review [Preprint]."", ""year"": 2025}, {""title"": ""How accurate are high resolution settlement maps at predicting population counts in data scarce settings?"", ""url"": ""https://www.doi.org/10.31219/osf.io/pz38h_v1"", ""type"": null, ""citation"": ""Darin, E., Leasure, D. and Kashyap, R. (2025) “ How accurate are high resolution settlement maps at predicting population counts in data scarce settings? ”, OSF Preprints ."", ""year"": 2025}, {""title"": ""Temperature and Sex Ratios at Birth"", ""url"": ""https://www.doi.org/10.31219/osf.io/wj7ke"", ""type"": null, ""citation"": ""Abdel Ghany, J. et al. (2024) “ Temperature and Sex Ratios at Birth ”, OSF Preprints ."", ""year"": 2024}, {""title"": ""Social capital mediates knowledge gaps in informing sexual and reproductive health behaviours across Africa"", ""url"": ""https://www.doi.org/10.1016/j.socscimed.2024.117159"", ""type"": null, ""citation"": ""Koebe, T. et al. (2024) “ Social capital mediates knowledge gaps in informing sexual and reproductive health behaviours across Africa ”, Social Science and Medicine , 357."", ""year"": 2024}]",https://openalex.org/A5031279419,https://orcid.org/0000-0003-0615-2868,HIGH,"Oxford-filtered search. Oxford-works=57, score=6.00","[{""id"": ""https://openalex.org/A5031279419"", ""display_name"": ""Ridhi Kashyap"", ""works_count"": 98, ""oxford_works"": 57}, {""id"": ""https://openalex.org/A5123444142"", ""display_name"": ""Ridhi Kashyap"", ""works_count"": 3, ""oxford_works"": 2}]"
Augustine Kong,https://www.demography.ox.ac.uk/people/augustine-kong,Professor of Statistical Genetics,augustine.kong@bdi.ox.ac.uk,"[{""title"": ""Realizing the full potential of Our Future Health through data linkage and trans-biobank efforts"", ""url"": ""https://www.doi.org/10.1038/s41588-025-02327-7"", ""type"": null, ""citation"": ""Straub, V. et al. (2025) “ Realizing the full potential of Our Future Health through data linkage and trans-biobank efforts ”, Nature Genetics , 57(10), pp. 2341–2348."", ""year"": 2025}, {""title"": ""Studying the genetics of participation using footprints left on the ascertained genotypes"", ""url"": ""https://www.doi.org/10.1038/s41588-023-01439-2"", ""type"": null, ""citation"": ""Benonisdottir, S. and Kong, A. (2023) “ Studying the genetics of participation using footprints left on the ascertained genotypes ”, Nature Genetics , 55(8), pp. 1413–1420."", ""year"": 2023}, {""title"": ""Mendelian imputation of parental genotypes improves estimates of direct genetic effects"", ""url"": ""https://www.doi.org/10.1038/s41588-022-01085-0"", ""type"": null, ""citation"": ""Young, A. et al. (2022) “ Mendelian imputation of parental genotypes improves estimates of direct genetic effects ”, Nature Genetics , 54(6), pp. 897–905."", ""year"": 2022}, {""title"": ""Deconstructing the sources of genotype-phenotype associations in humans"", ""url"": ""https://www.doi.org/10.1126/science.aax3710"", ""type"": null, ""citation"": ""Young, A. et al. (2019) “ Deconstructing the sources of genotype-phenotype associations in humans ”, Science , 365(6460), pp. 1396–1400."", ""year"": 2019}, {""title"": ""Multiple transmissions of de novo mutations in families"", ""url"": ""https://www.doi.org/10.1038/s41588-018-0259-9"", ""type"": null, ""citation"": ""Jónsson, H. et al. (2018) “ Multiple transmissions of de novo mutations in families ”, Nature Genetics , 50(12), pp. 1674–1680."", ""year"": 2018}, {""title"": ""Relatedness disequilibrium regression estimates heritability without environmental bias"", ""url"": ""https://www.doi.org/10.1038/s41588-018-0178-9"", ""type"": null, ""citation"": ""Young, A. et al. (2018) “ Relatedness disequilibrium regression estimates heritability without environmental bias ”, Nature Genetics , 50(9), pp. 1304–1310."", ""year"": 2018}, {""title"": ""The nature of nurture: Effects of parental genotypes"", ""url"": ""https://www.doi.org/10.1126/science.aan6877"", ""type"": null, ""citation"": ""Kong, A. et al. (2018) “ The nature of nurture: Effects of parental genotypes ”, Science , 359(6374), pp. 424–428."", ""year"": 2018}, {""title"": ""Whole genome characterization of sequence diversity of 15,220 Icelanders"", ""url"": ""https://www.doi.org/10.1038/sdata.2017.115"", ""type"": null, ""citation"": ""Jónsson, H. et al. (2017) “ Whole genome characterization of sequence diversity of 15,220 Icelanders ”, Scientific Data , 4(1), p. 170115."", ""year"": 2017}, {""title"": ""Parental influence on human germline de novo mutations in 1,548 trios from Iceland"", ""url"": ""https://www.doi.org/10.1038/nature24018"", ""type"": null, ""citation"": ""Jónsson, H. et al. (2017) “ Parental influence on human germline de novo mutations in 1,548 trios from Iceland ”, Nature , 549(7673), pp. 519–522."", ""year"": 2017}, {""title"": ""Clonal hematopoiesis, with and without candidate driver mutations, is common in the elderly"", ""url"": ""https://www.doi.org/10.1182/blood-2017-02-769869"", ""type"": null, ""citation"": ""Zink, F. et al. (2017) “ Clonal hematopoiesis, with and without candidate driver mutations, is common in the elderly ”, Blood , 130(6), pp. 742–752."", ""year"": 2017}]",https://openalex.org/A5072041322,https://orcid.org/0000-0001-8193-5438,HIGH,"Oxford-filtered search. Oxford-works=13, score=5.60","[{""id"": ""https://openalex.org/A5072041322"", ""display_name"": ""Augustine Kong"", ""works_count"": 292, ""oxford_works"": 13}]"
Charles Rahal,https://www.demography.ox.ac.uk/people/charles-rahal,Associate Professor,charles.rahal@demography.ox.ac.uk,"[{""title"": ""On the unknowable limits to prediction"", ""url"": ""https://www.doi.org/10.1038/s43588-025-00776-y"", ""type"": null, ""citation"": ""Yan, J. and Rahal, C. (2025) “ On the unknowable limits to prediction ”, Nature Computational Science [Preprint]."", ""year"": 2025}, {""title"": ""Capitalizing on a crisis: a computational analysis of all five million British firms during the Covid-19 pandemic"", ""url"": ""https://www.doi.org/10.1007/s42001-025-00360-4"", ""type"": null, ""citation"": ""Muggleton, N., Rahal, C. and Reeves, A. (2025) “ Capitalizing on a crisis: a computational analysis of all five million British firms during the Covid-19 pandemic ”, Journal of Computational Social Science , 8(2)."", ""year"": 2025}, {""title"": ""The role of the third sector in public health service provision: evidence from 25,338 heterogeneous procurement datasets"", ""url"": ""https://www.doi.org/10.1093/jrsssa/qnae092"", ""type"": null, ""citation"": ""Rahal, C. and Mohan, J. (2024) “ The role of the third sector in public health service provision: evidence from 25,338 heterogeneous procurement datasets ”, Journal of the Royal Statistical Society Series A: Statistics in Society [Preprint]."", ""year"": 2024}, {""title"": ""The intermodel vigorish as a lens for understanding (and quantifying) the value of item response models for dichotomously coded items"", ""url"": ""https://www.doi.org/10.1007/s11336-024-09977-2"", ""type"": null, ""citation"": ""Domingue, B. et al. (2024) “ The intermodel vigorish as a lens for understanding (and quantifying) the value of item response models for dichotomously coded items ”, Psychometrika , 89(3), pp. 1034–1054."", ""year"": 2024}, {""title"": ""The rise of machine learning in the academic social sciences"", ""url"": ""https://www.doi.org/10.1007/s00146-022-01540-w"", ""type"": null, ""citation"": ""Rahal, C., Verhagen, M. and Kirk, D. (2024) “ The rise of machine learning in the academic social sciences ”, AI &amp; SOCIETY , 39(2), pp. 799–801."", ""year"": 2024}, {""title"": ""Publisher Correction: Offshoring emissions through used vehicle exports"", ""url"": ""https://www.doi.org/10.1038/s41558-024-01965-9"", ""type"": null, ""citation"": ""Newman, S. et al. (2024) “ Publisher Correction: Offshoring emissions through used vehicle exports ”, Nature Climate Change , 14(3), pp. 297–297."", ""year"": 2024}, {""title"": ""Offshoring Emissions through Used Vehicle Exports"", ""url"": ""https://www.doi.org/10.48550/arxiv.2402.13807"", ""type"": null, ""citation"": ""Newman, S. et al. (2024) “ Offshoring Emissions through Used Vehicle Exports ”, arXiv ."", ""year"": 2024}, {""title"": ""Offshoring emissions through used vehicle exports"", ""url"": ""https://www.doi.org/10.1038/s41558-024-01943-1"", ""type"": null, ""citation"": ""Newman, S. et al. (2024) “ Offshoring emissions through used vehicle exports ”, Nature Climate Change , 14(3), pp. 238–241."", ""year"": 2024}, {""title"": ""The rise of machine learning in the academic social sciences"", ""url"": ""https://www.doi.org/10.1007/s00146-022-01540-w"", ""type"": null, ""citation"": ""Rahal, C., Verhagen, M. and Kirk, D. (2022) “ The rise of machine learning in the academic social sciences ”, AI and Society , 39(2), pp. 799–801."", ""year"": 2022}, {""title"": ""Population studies at 75 years: an empirical review"", ""url"": ""https://www.doi.org/10.1080/00324728.2021.1996624"", ""type"": null, ""citation"": ""Mills, M. and Rahal, R. (2021) “ Population studies at 75 years: an empirical review ”, Population Studies , 75(S1), pp. 7–25."", ""year"": 2021}]",https://openalex.org/A5075497327,https://orcid.org/0000-0002-1764-2697,HIGH,"Oxford-filtered search. Oxford-works=28, score=6.00","[{""id"": ""https://openalex.org/A5075497327"", ""display_name"": ""Charles Rahal"", ""works_count"": 48, ""oxford_works"": 28}]"
