name,profile_url,role,email,recent_publications_json,openalex_author_id,openalex_orcid,openalex_confidence,openalex_notes,openalex_candidates_json
Douglas Leasure,https://www.demography.ox.ac.uk/people/douglas-leasure,Senior Researcher and Data Scientist,douglas.leasure@demography.ox.ac.uk,"[{""title"": ""Advances in Small Area Population Estimation in the Absence of National Census Data"", ""url"": ""https://www.doi.org/10.20944/preprints202506.1625.v2"", ""type"": null, ""citation"": ""Lazar, A. et al. (2025) “ Advances in Small Area Population Estimation in the Absence of National Census Data ”, Preprints.org ."", ""year"": 2025}, {""title"": ""Mapping subnational gender gaps in internet and mobile adoption using social media data"", ""url"": ""https://www.doi.org/10.1073/pnas.2416624122"", ""type"": null, ""citation"": ""Breen, C. et al. (2025) “ Mapping subnational gender gaps in internet and mobile adoption using social media data ”, Proceedings of the National Academy of Sciences , 122(42)."", ""year"": 2025}, {""title"": ""How Accurate Are High Resolution Settlement Maps at Predicting Population Counts in Data Scarce Settings?"", ""url"": ""https://www.doi.org/10.1002/psp.70083"", ""type"": null, ""citation"": ""Darin, E., Kashyap, R. and Leasure, D. (2025) “ How Accurate Are High Resolution Settlement Maps at Predicting Population Counts in Data Scarce Settings? ”, Population, Space and Place , 31(6)."", ""year"": 2025}, {""title"": ""Advances in Small Area Population Estimation in the Absence of National Census Data"", ""url"": ""https://www.doi.org/10.20944/preprints202506.1625.v1"", ""type"": null, ""citation"": ""Lazar, A. et al. (2025) “ Advances in Small Area Population Estimation in the Absence of National Census Data ”, Preprints.org ."", ""year"": 2025}, {""title"": ""How accurate are high resolution settlement maps at predicting population counts in data scarce settings?"", ""url"": ""https://www.doi.org/10.31219/osf.io/pz38h_v1"", ""type"": null, ""citation"": ""Darin, E., Leasure, D. and Kashyap, R. (2025) “ How accurate are high resolution settlement maps at predicting population counts in data scarce settings? ”, OSF Preprints ."", ""year"": 2025}, {""title"": ""Elemental composition and potential toxicity of the riverine macrophyte Podostemum ceratophyllum Michx. reflects land use in eastern North America"", ""url"": ""https://www.doi.org/10.1016/j.scitotenv.2024.176118"", ""type"": null, ""citation"": ""Wood, J. et al. (2024) “ Elemental composition and potential toxicity of the riverine macrophyte Podostemum ceratophyllum Michx. reflects land use in eastern North America ”, The Science of The Total Environment , 954, p. 176118."", ""year"": 2024}, {""title"": ""‘UPDATE: I’m pregnant!’: Inferring global downloads and reasons for using menstrual tracking apps"", ""url"": ""https://www.doi.org/10.1177/20552076241298315"", ""type"": null, ""citation"": ""Rampazzo, F. et al. (2024) “ ‘UPDATE: I’m pregnant!’: Inferring global downloads and reasons for using menstrual tracking apps ”, Digital Health , 10."", ""year"": 2024}, {""title"": ""Social capital mediates knowledge gaps in informing sexual and reproductive health behaviours across Africa"", ""url"": ""https://www.doi.org/10.1016/j.socscimed.2024.117159"", ""type"": null, ""citation"": ""Koebe, T. et al. (2024) “ Social capital mediates knowledge gaps in informing sexual and reproductive health behaviours across Africa ”, Social Science and Medicine , 357."", ""year"": 2024}, {""title"": ""Publisher Correction: Offshoring emissions through used vehicle exports"", ""url"": ""https://www.doi.org/10.1038/s41558-024-01965-9"", ""type"": null, ""citation"": ""Newman, S. et al. (2024) “ Publisher Correction: Offshoring emissions through used vehicle exports ”, Nature Climate Change , 14(3), pp. 297–297."", ""year"": 2024}, {""title"": ""Offshoring Emissions through Used Vehicle Exports"", ""url"": ""https://www.doi.org/10.48550/arxiv.2402.13807"", ""type"": null, ""citation"": ""Newman, S. et al. (2024) “ Offshoring Emissions through Used Vehicle Exports ”, arXiv ."", ""year"": 2024}]",https://openalex.org/A5068650951,https://orcid.org/0000-0002-8768-2811,HIGH,"Oxford-filtered search. Oxford-works=23, score=5.73","[{""id"": ""https://openalex.org/A5068650951"", ""display_name"": ""Douglas R. Leasure"", ""works_count"": 70, ""oxford_works"": 23}]"
Joshua Wilde,https://www.demography.ox.ac.uk/people/joshua-wilde,Senior Scientist and Researcher,josh.wilde@demography.ox.ac.uk,"[{""title"": ""Editors’ Note on the December 2025 Issue"", ""url"": ""https://www.doi.org/10.1111/padr.70041"", ""type"": null, ""citation"": ""Muttarak, R. and Wilde, J. (2025) “ Editors’ Note on the December 2025 Issue ”, Population and Development Review , 51(4), pp. 1277–1278."", ""year"": 2025}, {""title"": ""Accounting for stillbirths in maternal health metrics: a cross-country analysis"", ""url"": ""https://www.doi.org/10.1016/j.eclinm.2025.103303"", ""type"": null, ""citation"": ""Gazeley, U. et al. (2025) “ Accounting for stillbirths in maternal health metrics: a cross-country analysis ”, EClinicalMedicine , 85, p. 103303."", ""year"": 2025}, {""title"": ""Editors’ Note on Looking Backward, Looking Forward: Celebrating 50 Years of Population and Development Review"", ""url"": ""https://www.doi.org/10.1111/padr.70002"", ""type"": null, ""citation"": ""Muttarak, R. and Wilde, J. (2025) “ Editors’ Note on Looking Backward, Looking Forward: Celebrating 50 Years of Population and Development Review ”, Population and Development Review [Preprint]."", ""year"": 2025}, {""title"": ""Ambient air pollution and the sex ratio at birth: a systematic review and narrative synthesis"", ""url"": ""https://www.doi.org/10.1101/2025.10.21.25338487"", ""type"": null, ""citation"": ""Gazeley, U. et al. (2025) “ Ambient air pollution and the sex ratio at birth: a systematic review and narrative synthesis ”, medRxiv ."", ""year"": 2025}, {""title"": ""Senderowicz and Maloney (2022): comment, rejoinder, and erratum"", ""url"": ""https://www.doi.org/10.1111/padr.12704"", ""type"": null, ""citation"": ""Muttarak, R. and Wilde, J. (2024) “ Senderowicz and Maloney (2022): comment, rejoinder, and erratum ”, Population and Development Review , 50(4), pp. 1461–1463."", ""year"": 2024}, {""title"": ""Editors’ Note on the December 2024 Issue"", ""url"": ""https://www.doi.org/10.1111/padr.12703"", ""type"": null, ""citation"": ""Muttarak, R. and Wilde, J. (2024) “ Editors’ Note on the December 2024 Issue ”, Population and Development Review , 50(4), pp. 959–960."", ""year"": 2024}, {""title"": ""Economic Foundations of Contraceptive Transitions: Theories and a Review of the Evidence"", ""url"": ""https://www.doi.org/10.1111/padr.12690"", ""type"": null, ""citation"": ""Karra, M. and Wilde, J. (2024) “ Economic Foundations of Contraceptive Transitions: Theories and a Review of the Evidence ”, Population and Development Review [Preprint]."", ""year"": 2024}, {""title"": ""Temperature and fertility: Evidence from Spain"", ""url"": ""https://www.doi.org/10.1080/00324728.2024.2382152"", ""type"": null, ""citation"": ""Conte Keivabu, R., Cozzani, M. and Wilde, J. (2024) “ Temperature and fertility: Evidence from Spain ”, Population Studies , ahead-of-print(ahead-of-print), pp. 1–15."", ""year"": 2024}, {""title"": ""Fertility and Family Dynamics in the Aftermath of the COVID‐19 Pandemic"", ""url"": ""https://www.doi.org/10.1111/padr.12648"", ""type"": null, ""citation"": ""Nitsche, N. and Wilde, J. (2024) “ Fertility and Family Dynamics in the Aftermath of the COVID‐19 Pandemic ”, Population and Development Review , 50(S1), pp. 9–22."", ""year"": 2024}, {""title"": ""Digital Trace Data and Demographic Forecasting: How Well Did Google Predict the US COVID‐19 Baby Bust?"", ""url"": ""https://www.doi.org/10.1111/padr.12647"", ""type"": null, ""citation"": ""Wilde, J. et al. (2024) “ Digital Trace Data and Demographic Forecasting: How Well Did Google Predict the US COVID‐19 Baby Bust? ”, Population and Development Review , 50(S1), pp. 421–446."", ""year"": 2024}]",https://openalex.org/A5064732601,https://orcid.org/0000-0003-3389-2028,HIGH,"Oxford-filtered search. Oxford-works=10, score=5.00","[{""id"": ""https://openalex.org/A5064732601"", ""display_name"": ""Joshua Wilde"", ""works_count"": 63, ""oxford_works"": 10}, {""id"": ""https://openalex.org/A5108906266"", ""display_name"": ""JOSHUA WILDE"", ""works_count"": 1, ""oxford_works"": 1}]"
José Manuel Aburto,https://www.demography.ox.ac.uk/people/jose-manuel-aburto,Marie Skłodowska-Curie Research Fellow / Brass Blacker Associate Professor of Demography at LSHTM,jose-manuel.aburto@demography.ox.ac.uk,"[{""title"": ""How lifespan and life years lost equate to unity"", ""url"": ""https://www.doi.org/10.4054/demres.2024.50.24"", ""type"": null, ""citation"": ""Baudisch, A. and Aburto, J. (2024) “ How lifespan and life years lost equate to unity ”, Demographic Research , 50, pp. 643–666."", ""year"": 2024}, {""title"": ""Contributions of age groups and causes of death to the sex gap in lifespan variation in Europe"", ""url"": ""https://www.doi.org/10.1080/00324728.2023.2222723"", ""type"": null, ""citation"": ""Zazueta-Borboa, J.-D. et al. (2023) “ Contributions of age groups and causes of death to the sex gap in lifespan variation in Europe ”, Population Studies , 77(3), pp. 475–496."", ""year"": 2023}, {""title"": ""The gap between US and best practice life expectancy is increasing"", ""url"": ""https://www.doi.org/10.2105/AJPH.2023.307332"", ""type"": null, ""citation"": ""Aburto, J. and Vigezzi, S. (2023) “ The gap between US and best practice life expectancy is increasing ”, American Journal of Public Health , 113(9), pp. 967–969."", ""year"": 2023}, {""title"": ""Reversals in past long-term trends in educational inequalities in life expectancy for selected European countries"", ""url"": ""https://www.doi.org/10.1136/jech-2023-220385"", ""type"": null, ""citation"": ""Zazueta-Borboa, J. et al. (2023) “ Reversals in past long-term trends in educational inequalities in life expectancy for selected European countries ”, Journal of Epidemiology and Community Health , 77(7)."", ""year"": 2023}, {""title"": ""A global assessment of the impact of violence on lifetime uncertainty"", ""url"": ""https://www.doi.org/10.1126/sciadv.add9038"", ""type"": null, ""citation"": ""Aburto, J. et al. (2023) “ A global assessment of the impact of violence on lifetime uncertainty ”, Science Advances , 9(5)."", ""year"": 2023}, {""title"": ""Evaluation of age-specific causes of death in the context of the Italian longevity transition"", ""url"": ""https://www.doi.org/10.1038/s41598-022-26907-3"", ""type"": null, ""citation"": ""Nigri, A. et al. (2022) “ Evaluation of age-specific causes of death in the context of the Italian longevity transition ”, Scientific reports , 12(1)."", ""year"": 2022}, {""title"": ""Life expectancy changes since COVID-19"", ""url"": ""https://www.doi.org/10.1038/s41562-022-01450-3"", ""type"": null, ""citation"": ""Schöley, J. et al. (2022) “ Life expectancy changes since COVID-19 ”, Nature Human Behaviour , 6, pp. 1649–1659."", ""year"": 2022}, {""title"": ""Socio-demographic inequalities and excess non-COVID-19 mortality during the COVID-19 pandemic: a data-driven analysis of 1 069 174 death certificates in Mexico"", ""url"": ""https://www.doi.org/10.1093/ije/dyac184"", ""type"": null, ""citation"": ""Antonio-Villa, N. et al. (2022) “ Socio-demographic inequalities and excess non-COVID-19 mortality during the COVID-19 pandemic: a data-driven analysis of 1 069 174 death certificates in Mexico ”, International Journal of Epidemiology , 51(6), pp. 1711–1721."", ""year"": 2022}, {""title"": ""Drewnowski’s index to measure lifespan variation: revisiting the Gini coefficient of the life table"", ""url"": ""https://www.doi.org/10.1016/j.tpb.2022.08.003"", ""type"": null, ""citation"": ""Aburto, J. et al. (2022) “ Drewnowski’s index to measure lifespan variation: revisiting the Gini coefficient of the life table ”, Theoretical Population Biology , 148, pp. 1–10."", ""year"": 2022}, {""title"": ""Significant impacts of the COVID-19 pandemic on race/ethnic differences in US mortality"", ""url"": ""https://www.doi.org/10.1073/pnas.2205813119"", ""type"": null, ""citation"": ""Aburto, J. et al. (2022) “ Significant impacts of the COVID-19 pandemic on race/ethnic differences in US mortality ”, Proceedings of the National Academy of Sciences , 119(35)."", ""year"": 2022}]",https://openalex.org/A5125102852,,MEDIUM,"Oxford-filtered search. Oxford-works=1, score=2.96","[{""id"": ""https://openalex.org/A5125102852"", ""display_name"": ""Jose  Manuel Aburto"", ""works_count"": 2, ""oxford_works"": 1}]"
Romola Davenport,https://www.demography.ox.ac.uk/people/romola-davenport,"Research Professor, Cambridge Group for the History of Population and Social Structure",rjd23@cam.ac.uk,[],https://openalex.org/A5037098543,https://orcid.org/0000-0002-6828-9846,LOW,"Fallback global search. Oxford-works=0, score=3.00","[{""id"": ""https://openalex.org/A5037098543"", ""display_name"": ""Romola Davenport"", ""works_count"": 43, ""oxford_works"": 0}]"
Andrea Tilstra,https://www.demography.ox.ac.uk/people/andrea-tilstra,Senior Researcher in Social Demography,andrea.tilstra@demography.ox.ac.uk,"[{""title"": ""Mortality Patterns in the Intersex Population"", ""url"": ""https://www.doi.org/10.31235/osf.io/bu92v_v1"", ""type"": null, ""citation"": ""Thomsen, M., Tilstra, A. and Greve, J. (2026) “ Mortality Patterns in the Intersex Population ”, SocArXiv ."", ""year"": 2026}, {""title"": ""Marital Separation, BMI Decline, and the Myth of the Revenge Body"", ""url"": ""https://www.doi.org/10.31235/osf.io/hney5_v1"", ""type"": null, ""citation"": ""Kapelle, N. and Tilstra, A. (2025) “ Marital Separation, BMI Decline, and the Myth of the Revenge Body ”, Center for Open Science ."", ""year"": 2025}, {""title"": ""Breaking bonds, changing habits: understanding health behaviors during and after marital dissolution"", ""url"": ""https://www.doi.org/10.1177/00221465251320079"", ""type"": null, ""citation"": ""Tilstra, A. and Kapelle, N. (2025) “ Breaking bonds, changing habits: understanding health behaviors during and after marital dissolution ”, Journal of Health and Social Behavior [Preprint]."", ""year"": 2025}, {""title"": ""Progress Stalled? The Uncertain Future of Mortality in High‐Income Countries"", ""url"": ""https://www.doi.org/10.1111/padr.12687"", ""type"": null, ""citation"": ""Dowd, J., Polizzi, A. and Tilstra, A. (2024) “ Progress Stalled? The Uncertain Future of Mortality in High‐Income Countries ”, Population and Development Review [Preprint]."", ""year"": 2024}, {""title"": ""Midlife health in Britain and the United States: a comparison of two nationally representative cohorts"", ""url"": ""https://www.doi.org/10.1093/ije/dyae127"", ""type"": null, ""citation"": ""Staatz, C. et al. (2024) “ Midlife health in Britain and the United States: a comparison of two nationally representative cohorts ”, International Journal of Epidemiology , 53(5), p. dyae127."", ""year"": 2024}, {""title"": ""Why is life expectancy in England and Wales falling behind? A cause-of-death decomposition approach."", ""url"": ""https://www.doi.org/10.31235/osf.io/caswv"", ""type"": null, ""citation"": ""Polizzi, A. et al. (2024) “ Why is life expectancy in England and Wales falling behind? A cause-of-death decomposition approach. ”, SocArXiv ."", ""year"": 2024}, {""title"": ""The impact of early death on birth counts in the United States, 1950 to 2019"", ""url"": ""https://www.doi.org/10.1093/pnasnexus/pgae058"", ""type"": null, ""citation"": ""Polizzi, A. and Tilstra, A. (2024) “ The impact of early death on birth counts in the United States, 1950 to 2019 ”, PNAS Nexus , 3(6)."", ""year"": 2024}, {""title"": ""Breaking Bonds, Changing Habits: Understanding Health Behaviors during and after Marital Dissolution"", ""url"": ""https://www.doi.org/10.31235/osf.io/h8w53"", ""type"": null, ""citation"": ""Tilstra, A. and Kapelle, N. (2024) “ Breaking Bonds, Changing Habits: Understanding Health Behaviors during and after Marital Dissolution ”, SocArXiv ."", ""year"": 2024}, {""title"": ""US exceptionalism? International trends in midlife mortality"", ""url"": ""https://www.doi.org/10.1093/ije/dyae024"", ""type"": null, ""citation"": ""Dowd, J. et al. (2024) “ US exceptionalism? International trends in midlife mortality ”, International Journal of Epidemiology , 53(2)."", ""year"": 2024}, {""title"": ""Projecting the long-term effects of the COVID-19 pandemic on U.S. population structure"", ""url"": ""https://www.doi.org/10.1038/s41467-024-46582-4"", ""type"": null, ""citation"": ""Tilstra, A. et al. (2024) “ Projecting the long-term effects of the COVID-19 pandemic on U.S. population structure ”, Nature Communications , 15(1), p. 2409."", ""year"": 2024}]",https://openalex.org/A5037746846,https://orcid.org/0000-0001-7622-9088,HIGH,"Oxford-filtered search. Oxford-works=26, score=5.71","[{""id"": ""https://openalex.org/A5037746846"", ""display_name"": ""Andrea M. Tilstra"", ""works_count"": 42, ""oxford_works"": 26}]"
Thomas Rawson,https://www.demography.ox.ac.uk/people/thomas-rawson,Senior Researcher in Health Analytics & Modelling,,"[{""title"": ""An outbreak of highly pathogenic avian influenza H5N1 could impact the dairy cattle sector and the broader economy in the United States"", ""url"": ""https://www.doi.org/10.1038/s43247-025-03153-9"", ""type"": null, ""citation"": ""Morel, G. et al. (2026) “ An outbreak of highly pathogenic avian influenza H5N1 could impact the dairy cattle sector and the broader economy in the United States ”, Communications Earth & Environment [Preprint]."", ""year"": 2026}, {""title"": ""Severe acute respiratory syndrome (SARS) mathematical models and disease parameters: a systematic review"", ""url"": ""https://www.doi.org/10.1016/j.lanmic.2025.101144"", ""type"": null, ""citation"": ""Morgenstern, C. et al. (2025) “ Severe acute respiratory syndrome (SARS) mathematical models and disease parameters: a systematic review ”, The Lancet Microbe , 6(9), pp. 101144–101144."", ""year"": 2025}, {""title"": ""Socioeconomic and temporal heterogeneity in SARS-CoV-2 exposure and disease in England from May 2020 to February 2023"", ""url"": ""https://www.doi.org/10.1126/sciadv.adu8678"", ""type"": null, ""citation"": ""Morgenstern, C. et al. (2025) “ Socioeconomic and temporal heterogeneity in SARS-CoV-2 exposure and disease in England from May 2020 to February 2023 ”, Science Advances , 11(21), p. eadu8678."", ""year"": 2025}, {""title"": ""A mathematical model of H5N1 influenza transmission in US dairy cattle"", ""url"": ""https://www.doi.org/10.1038/s41467-025-59554-z"", ""type"": null, ""citation"": ""Rawson, T. et al. (2025) “ A mathematical model of H5N1 influenza transmission in US dairy cattle ”, Nature Communications , 16(1), pp. 4308–4308."", ""year"": 2025}, {""title"": ""Associations between antibiotic consumption intensity and extended-spectrum cephalosporin resistance in nursing homes: a retrospective ecological study"", ""url"": ""https://www.doi.org/10.1093/jacamr/dlaf088"", ""type"": null, ""citation"": ""Glampedakis, E. et al. (2025) “ Associations between antibiotic consumption intensity and extended-spectrum cephalosporin resistance in nursing homes: a retrospective ecological study ”, JAC-Antimicrobial Resistance , 7(3), p. dlaf088."", ""year"": 2025}, {""title"": ""Lassa fever outbreaks, mathematical models, and disease parameters: a systematic review and meta-analysis"", ""url"": ""https://www.doi.org/10.1016/s2214-109x(24)00379-6"", ""type"": null, ""citation"": ""Doohan, P. et al. (2024) “ Lassa fever outbreaks, mathematical models, and disease parameters: a systematic review and meta-analysis ”, The Lancet Global Health , 12(12), pp. e1962 - e1972."", ""year"": 2024}, {""title"": ""Ebola virus disease mathematical models and epidemiological parameters: a systematic review"", ""url"": ""https://www.doi.org/10.1016/s1473-3099(24)00374-8"", ""type"": null, ""citation"": ""Nash, R. et al. (2024) “ Ebola virus disease mathematical models and epidemiological parameters: a systematic review ”, The Lancet Infectious Diseases , 24(12), pp. e762 - e773."", ""year"": 2024}, {""title"": ""Optimal approaches for COVID-19 control: the use of vaccines and lockdowns across societal groups"", ""url"": ""https://www.doi.org/10.3389/fepid.2024.1308974"", ""type"": null, ""citation"": ""Bonsall, M., Huntingford, C. and Rawson, T. (2024) “ Optimal approaches for COVID-19 control: the use of vaccines and lockdowns across societal groups ”, Frontiers in Epidemiology , 4."", ""year"": 2024}, {""title"": ""The impact of health inequity on spatial variation of COVID-19 transmission in England"", ""url"": ""https://www.doi.org/10.1371/journal.pcbi.1012141"", ""type"": null, ""citation"": ""Rawson, T. et al. (2024) “ The impact of health inequity on spatial variation of COVID-19 transmission in England ”, PLOS Computational Biology , 20(5), p. e1012141."", ""year"": 2024}, {""title"": ""Author Correction: Epidemiological drivers of transmissibility and severity of SARS-CoV-2 in England"", ""url"": ""https://www.doi.org/10.1038/s41467-023-44062-9"", ""type"": null, ""citation"": ""Perez-Guzman, P. et al. (2023) “ Author Correction: Epidemiological drivers of transmissibility and severity of SARS-CoV-2 in England ”, Nature Communications , 14(1), p. 8099."", ""year"": 2023}]",https://openalex.org/A5049683887,https://orcid.org/0000-0001-8182-4279,HIGH,"Fallback global search. Oxford-works=24, score=6.00","[{""id"": ""https://openalex.org/A5049683887"", ""display_name"": ""Thomas Rawson"", ""works_count"": 46, ""oxford_works"": 24}, {""id"": ""https://openalex.org/A5123962262"", ""display_name"": ""Thomas Rawson"", ""works_count"": 1, ""oxford_works"": 0}, {""id"": ""https://openalex.org/A5002159158"", ""display_name"": ""Thomas E. Rawson"", ""works_count"": 24, ""oxford_works"": 0}, {""id"": ""https://openalex.org/A5016692513"", ""display_name"": ""Thomas M. Rawson"", ""works_count"": 2, ""oxford_works"": 0}, {""id"": ""https://openalex.org/A5120907940"", ""display_name"": ""Thomas Ewan Rawson"", ""works_count"": 1, ""oxford_works"": 0}, {""id"": ""https://openalex.org/A5047860320"", ""display_name"": ""Thomas Rawson Birks"", ""works_count"": 28, ""oxford_works"": 0}, {""id"": ""https://openalex.org/A5037075517"", ""display_name"": ""Thomas Rawson Abban"", ""works_count"": 1, ""oxford_works"": 0}]"
